num	name	is_charity	charity_num	charity_type	org_type	affiliate_of	city	province	other_names	website_and_social_media	sex_ed_programs										
88.0	Crisis Pregnancy Centre of Vancouver & Richmond	Y	1	Poverty	CPC	PCC / Heartbeat Int’l / Care Net / Evangelical	Vancouver	BC	Crisis Pregnancy Centre of Vancouver Society Run by Christian Advocacy Society of Greater Vancouver	www.optionscentre.ca	"Offers S.H.A.R.E. program (Sexual health And Relationship Education). https://optionscentre.ca/share Says: “Our presentation contributes to BC’s curriculum requirements for PHE Grade 6-12.” And: “Thousands of high school students have now participated.” Have been “in schools and for youth groups in Vancouver, North Vancouver, West Vancouver, Richmond, Burnaby, New Westminster, Delta, Surrey and White Rock.”"										
89.0	Crossroads Clinic Association	Y	119156164	Poverty	CPC	PCC / Heartbeat Int’l / Evangelical	Brooks	AB		www.crossroadsclinic.ca http://facebook.com/crossroadsclinicbrook s	Community education in schools https://crossroadsclinic.ca/our-services/										
90.0	Crossroads Crisis Pregnancy Centre of Nanaimo	Y	885010645	"Community Org., Health"	CPC	PCC / Heartbeat Int’l / Care Net / Evangelical	Nanaimo	BC	Crisis Pregnancy Centre of Nanaimo Society / Crossroads Crisis Pregnancy Centre / Crossroads Crisis Pregnancy Centre of Nanaimo	www.cpcnanaimo.com/ www.facebook.com/CrossroadsCPC/ www.instagram.com/crossroadspregnancy /											
91.0	Dawn Centre	Y	874460405	Religion	CPC	PCC / Heartbeat Int’/ Care Net / Evangelical	Cambridge	ON	Cambridge Pregnancy Resource Centre	www.dawncentre.ca/ www.facebook.com/DawnCentreHealt handHope/ www.instagram.com/dawncentre/?hl=en	"Community Education, offers programs for Grades 7-12: www.dawncentre.ca/communityeducati on. Doesn’t specify public/religious"										
92.0	Dayspring Pregnancy & Family Support Centre	Y	727673808	"Community Org., Health"	CPC		Woodstock	ON	"(New, July 2023) Formerly: Beginnings Family Services"	https://dayspringfamily.ca/ www.facebook.com/DayspringWoodstock www.instagram.com/reel/C2lP1I1JOZI/											
93.0	Deep River Right to Life	N			Advocacy	Alliance for Life Ont.	Deep River	ON		https://allianceforlifeontario.ca/deep- river-right-to-life/											
94.0	deVeber Institute for Bioethics and Social Research (The)	Y	118964915	Education	Advocacy		Toronto	ON		www.deveber.org/											
95.0	Drayton Valley Respect for Life	N			Advocacy	LifeCanada	Drayton Valley	AB		www.facebook.com/dvrfl (FB not active since 2017) https://lifecanada.org/drayton/	https://lifecanada.org/our- work/lifecanada-kids/										
96.0	Droit a la vie Moncton Right to Life	N			Advocacy		Moncton	NB		www.dvmrl.com/											
97.0	Dun nville and Area Right to Life Association	N			Advocacy		Dunnville	ON		www.facebook.com/Dunnville-Area-Right- to-Life-155376037846391/											
98.0	Edmonton Against Abortion	N			Advocacy	CCBR (trained by)	Edmonton	AB		CCBR: www.endthekilling.ca www.facebook.com/EdmontonAgainstAbo rtion/	“Classroom - A series of lessons equipping you to effectively communicate the pro-life message using science and human rights.” www.endthekilling.ca/classroom/										
99.0	Edmonton Pro-life Society	Y	118894047	Poverty	Advocacy		Edmonton	AB		www.edmontonprolife.org/	"Offer scholarships, info resources and in- school talks www.edmontonprolife.org/education- resources"										
100.0	Enceinte et inquiète ?	N			CPC	Campagne Québec-Vie / Quebec Life Coalition	(Online)	QC		www.enceinteinquiete.org/ www.youtube.com/channel/UCy_MFKUb6 UQG1Omf6NCTuOA?view_as=subscrib er											
101.0	Envisage Pregnancy Services	Y	845016526	"Community Org., Health"	CPC	PCC / Heartbeat Int’l / Care Net / Evangelical	Barrie	ON	Formerly Barrie Pregnancy Resource Centre	https://envisagepregnancy.ca www.facebook.com/EnvisagePregnancy/	Nothing on website but previously had been seeking connections with schools: https://envisagepregnancy.ca/wp- content/uploads/2020/05/Envisage- Prayer-Sheet-Week4.pdf										
102.0	Envisage Pregnancy Services	Y	845016526	"Community Org., Health"	CPC	PCC / Heartbeat Int’l / Care Net / Evangelical	Collingwood	ON	Formerly Barrie Pregnancy Resource Centre	https://envisagepregnancy.ca www.facebook.com/EnvisagePregnancy/	Nothing on website but previously had been seeking connections with schools: https://envisagepregnancy.ca/wp- content/uploads/2020/05/Envisage- Prayer-Sheet-Week4.pdf										
103.0	Estevan Pro-Life	N			Advocacy	LifeCanada Saskatchewan Pro- Life	Estevan	SK	Pro-Life Estevan & Area Inc.	www.prolifeestevan.com/ www.facebook.com/groups/17696366234 3091/											
104.0	Evangelical Fellowship of Canada / Alliance Évangélique Du Canada	Y	107353922	Religion	Advocacy		Richmond Hill	ON		www.evangelicalfellowship.ca/											
105.0	Family Support Centre of Winnipeg Inc.	Y	101205904	Poverty	Advocacy	PCC / Heartbeat Int’l / Evangelical	Winnipeg	MB	"Ran Crisis Pregnancy Centre of Winnipeg, (Closed as of Mar- 23)"	www.familysupportcentre.ca/											
106.0	First Place Maternal Health Options Inc	Y	890251382	Poverty	CPC		Kanata	ON	First Place Options / Crisis Pregnancy Centre of Ottawa	www.firstplaceoptions.ca/ www.facebook.com/FirstPlaceOptions/	You're Worth It / THRIVE Community Education Ottawa. www.firstplaceoptions.ca/thrive/ “Grade 7 through 11 classrooms regarding sex and relationships”a No-cost. (Doesn’t specify if targeting public/religious schools) Curriculum overview: https://www.firstplaceoptions.ca/wp- content/uploads/2021/09/2021-THRIVE- curriculum-summary.pdf										
107.0	First Step Options Pregnancy Care Centre	Y	896363116	"Community Org., Health"	CPC	PCC / Heartbeat Int’l / Care Net / Evangelical	Pembroke	ON	First Step Options Centre	www.firststepoptions.com www.facebook.com/FirstStepOptions www.instagram.com/first_step_options/											
108.0	Focus on the Family (Canada) Association Inc.	Y	106845969	Religion	Advocacy		Langley	BC		www.focusonthefamily.ca/ www.facebook.com/fotfcanada/ https://twitter.com/fotfcanada/ www.youtube.com/channel/UCnJ4_k4JY_ O45NdJHoLxjJA	Lots of stuff on education but focus on parents doing the education										
109.0	Foundations for Life Association	Y	891768392	Education	Advocacy		Grande Prairie	AB	"Grande Prairie Voice for Life Association / Grande Prairie Foundations for Life [new name and website, July 2023]"	www.myfoundations.ca/ www.gpvoiceforlife.ca	www.myfoundations.ca/education K-7 & 8-12 www.gpvoiceforlife.ca/education.html										
110.0	Gianna Centre	Y	133696559 (Catholic Social Services)	Religion	CPC	Catholic Church	Edmonton	AB	Run by Catholic Social Services Formerly Edmonton Pregnancy Crisis Centre Association	www.cssalberta.ca/Gianna-Centre www.facebook.com/Giannayeg/ Twitter @GiannaCentre (not active)	"TeenStar:  A teach the educator program to teach children, adolescents, and young adults.  http://teenstar.org/"										
111.0	Goderich Life Centre	N			CPC	Alliance for Life Ont.	Goderich	ON	Goderich & District Pro Life	http://goderichlifecentre.com/ www.facebook.com/LifeCentreGoderich/											
112.0	Grey Bruce Pregnancy Centre	Y	869701862	"Community Org., Health"	CPC	PCC / Heartbeat Int’l / Care Net / Evangelical	Owen Sound	ON	Owen Sound Crisis Pregnancy Centre	www.owensoundcrisispregnancycentre.ca www.facebook.com/pg/ospregcentre	"Community education, but no mention of schools."										
113.0	Grimsby Life Centre Ministries	Y	806788824	Religion	CPC		Grimsby	ON		www.grimsbylife.org/ www.facebook.com/grimsbylifecentre/ https://twitter.com/grimsbylife (inactive 2011)											
114.0	Guelph & Area Right to Life Association	Y	891531048	Poverty	Advocacy	Alliance for Life Ont.	Guelph	ON	Runs Sanctuary Outreach CPC	http://guelphforlife.com/	"Classroom presentations: The Injustice of Abortion. “...your students will learn about abortion as a human rights violation, how to effectively dialogue about abortion, and how to help support those who may be suffering from the trauma of abortion.” No-cost, in-person. Grade 9 and up. Resources for teachers and classroom presentations: www.guelphforlife.com/for-educators (incl. “pro-life” lesson plans, pregnancy support training, brochures & posters with misinformation, tips on high-school “pro-life” clubs, and videos) (curriculum designed for the Catholic school board, “but can be adopted for any school”)"										
115.0	Haldimand Pregnancy Care Centre	Y	862343332	"Community Org., Health"	CPC		Caledonia	ON	Haldimand Pregnancy Care & Family Centre	http://haldimandpcfc.org/ www.facebook.com/haldimandpcfc/ www.instagram.com/haldimandpcfc/	Sexual Health & Relationships http://haldimandpcfc.org/programs/#14 45742559806-8d368fee-131d “sexual and relational health” presentations for grades 7-12. Doesn’t specify public/religious schools. Gamma Girls is for girls aged 10-13 (camp)										
116.0	Haldimand Pregnancy Care Centre	Y	862343332	"Community Org., Health"	CPC		Dunnville	ON	Haldimand Pregnancy Care & Family Centre	http://haldimandpcfc.org/ www.facebook.com/haldimandpcfc/ www.instagram.com/haldimandpcfc/	Sexual Health & Relationships http://haldimandpcfc.org/programs/#14 45742559806-8d368fee-131d “sexual and relational health” presentations for grades 7-12. Doesn’t specify public/religious schools. Gamma Girls is for girls aged 10-13 (camp)										
117.0	Halton Alive	Y	118951318	Poverty	Advocacy		Burlington	ON	Halton Pro-life	www.haltonalive.com	Promotes Life Talk seminars which seem to be an all-ages event promoting/educating “pro-life” stance; photos show teens/youth in attendance https://www.haltonalive.ca/ltseminar Halton Catholic Teachers Guild lists Halton Alive as a resource: https://haltoncatholicteachersguild.com /resources.html										
118.0	Hamilton Against Abortion	N			Advocacy	CCBR (trained by)	Hamilton	ON		CCBR: www.endthekilling.ca www.facebook.com/hamiltonagainstaborti on											
119.0	Hamilton Right to Life	Y	118951862	Poverty	Advocacy	Alliance for Life Ont.	Hamilton	ON		http://hamiltonrighttolife.org/	"Resources for educators: https://hamiltonrighttolife.org/resource s/educational-resources/ “To book a speaker or request a resource, please call us or email us” (no specifics) “Our mandate is to educate the public about life issues. We would welcome the opportunity to address your students about life issues in Canada.”"										
120.0	Hanover Pregnancy Centre	N			CPC	Alliance for Life Ont.	Hanover	ON	Hanover & District Right to Life	www.facebook.com/Hanover-Pregnancy- Centre-577848416030386/											
121.0	Haven Pregnancy Support Clinic	Y	889717369	Poverty	CPC	PCC / Heartbeat Int’l / Care Net / Evangelical	Victoria	BC	Victoria Pregnancy Centre Society	https://www.havenpsc.ca/ www.facebook.com/victoriapregnancycent re www.instagram.com/havenpregnancysupp ortclinic/	"Education Services: Prenatal, Childbirth, Parenting and Life Skills classes"										
122.0	High River Pro-life Association	N			Advocacy	LifeCanada	High River	AB	A chapter of The Wilberforce Project	www.facebook.com/HighRiverProLife/											
123.0	Hope for Women	Y	133318832	Poverty	CPC	Christian	Abbotsford	BC	Run by Advokate Life & Education Services Society	www.hopeforwomen.ca www.facebook.com/princegeorgepregnanc yservices/ twitter @HopeForWomen www.instagram.com/hope_for_women_pr ince_george/?hl=en	Used to teach SHIFT www.shiftbc.ca/ (Sexual health and intimacy for teens) but website no longer available as of Oct 2022										
124.0	Hope for Women	Y	133318832	Poverty	CPC	Christian	Langley	BC	Run by Advokate Life & Education Services Society	www.hopeforwomen.ca www.facebook.com/princegeorgepregnanc yservices/ twitter @HopeForWomen (inactive since 2019)	Used to teach SHIFT www.shiftbc.ca/ (Sexual health and intimacy for teens) but website no longer available as of Oct 2022										
125.0	Hope for Women	Y	133318832	Poverty	CPC	Christian	Prince George	BC	Prince George Pregnancy Care Centre / Run by Advokate Life & Education Services Society	www.hopeforwomen.ca www.facebook.com/princegeorgepregnanc yservices/ twitter @HopeForWomen www.instagram.com/hope_for_women/?h l=en	Used to teach SHIFT www.shiftbc.ca/ (Sexual health and intimacy for teens) but website no longer available as of Oct 2022										
126.0	Hope Pregnancy & Family Support Centre	Y	895406643	"Community Org., Resource"	CPC	PCC / Heartbeat Int’l / Evangelical	Brantford	ON	Pregnancy & Resource Centre Brant / Living Hope Pregnancy & Resource Centre / Brantford/Brant County Crisis Pregnancy Centre	www.hope-centre.com/ www.facebook.com/PRCBrant/ https://twitter.com/prcbrant www.youtube.com/results?search_query= prcbrant											
127.0	Hope Pregnancy Support Centre	Y	811292390	"Community Org., Health"	CPC	PCC / Heartbeat Int’l/Care Net / Evangelical	Parry Sound	ON		https://parrysoundhope.com/ www.facebook.com/HOPEPregnancySuppo rtCentre/ https://twitter.com/pregnancy_hope www.instagram.com/parrysoundhope/											
128.0	Hopewell Clinic & Pregnancy Centre Society	Y	856145594	Religion	CPC	PCC / Heartbeat Int’l / Care Net / Evangelical	Kamloops	BC	Pregnancy Care Centre / Pregnancy Care Centre Society of Kamloops / Kamloops Pregnancy Care Centre	www.hopewellkamloops.ca/ www.facebook.com/Pregnancycarekamloo ps/ https://twitter.com/CareKamloops											
129.0	House of Grace Pregnancy Centre	N		Religion	CPC	PCC	Duncan	BC	Associated with New Life Community Baptist Church	www.houseofgrace.ca/ https://newlifechurch.ca/											
130.0	Ingersoll Right to Life	N			Advocacy	Alliance for Life Ont.	Ingersoll	ON		https://allianceforlifeontario.ca/ingersoll- right-to-life/											
131.0	Island Pregnancy Care & Support Services Inc.	Y	802595157	Religion	CPC	PCC / Care Net / Evangelical	Charlottetown	PE	Island Pregnancy Centre	www.islandpregnancycentre.com www.facebook.com/Island-Pregnancy- Centre-219080438117714/ www.instagram.com/islandpregnancycentr e/?hl=en											
132.0	Island Pregnancy Care & Support Services Inc.	Y	802595157	Religion	CPC	PCC / Care Net / Evangelical	Summerside	PE	Island Pregnancy Centre	www.islandpregnancycentre.com www.facebook.com/Island-Pregnancy- Centre-219080438117714/ www.instagram.com/islandpregnancycentr e/?hl=en											
133.0	Jewels for Jesus Adoption Agency Inc.	Y	118974096	Poverty	Adoption		Mississauga	ON	"Affiliated with JFJ Hope Centre, but different CRA #"	https://jfjhopecentre.ca/adoption/											
134.0	JFJ Hope Centre	Y	118974104	Poverty	CPC	PCC / Heartbeat Int’l / Care Net / Evangelical	Mississauga	ON	Jewels for Jesus Mission Inc.	www.jfjhopecentre.ca www.facebook.com/JFJ-Hope-Centre- 378942612153466/ https://twitter.com/JFJHopeCentre www.instagram.com/jfjhopecentre/	"Used to run this, but no longer on website: Relationship Compass in schools. https://jfjhopecentre.ca/education/ Catholic and Christian schools"										
135.0	Justice Centre for Constitutional Freedoms	Y	817174865	"Community Org., Human Rights"	Advocacy		Calgary	AB		www.jccf.ca/	"They are developing a high school curriculum on the Canadian Charter of Rights and Freedoms, not sex ed"										
136.0	Kamloops Pro-life Society	Y	118977230	Poverty	Advocacy	Christian / Catholic?	Kamloops	BC	Voices 4 Life	www.voices4life.com/ www.facebook.com/kamloopsprolife www.instagram.com/kamloopsprolifesocie ty	"Offers a video for schools: “The Biology of Prenatal Development is recommended for use in middle and high school health and biology courses, introductory college- and graduate-level human embryology courses, and prenatal care classes.” www.voices4life.com/life-in-the-womb/"										
137.0	Kawartha Lakes Pregnancy Centre	Y	893809293	Poverty	CPC	PCC / Heartbeat Int’l / Care Net / Evangelical	Lindsay	ON	Lindsay Crisis Pregnancy Centre	www.klpcentre.ca www.facebook.com/klpcentre/ www.instagram.com/kawarthalakespregna ncycentre/?hl=en											
138.0	Kelowna Right to Life Society	Y	118978865	Poverty	Advocacy	LifeCanada Christian	Kelowna	BC	Originally” Voice of the Unborn”	https://lifecanada.org/kelowna/ www.facebook.com/Kelowna-Right-to-Life- Society-100238543467038/ twitter @ktownright2life www.youtube.com/channel/UCN7LgRsbTs vSbk1CSM2y8pw/channels											
139.0	Kincardine Right to Life	Y	118981240	Poverty	Advocacy	Alliance for Life Ont.	Kincardine	ON	Kincardine & District Right to Life Group	www.facebook.com/kincardinerighttolife/											
140.0	Kirkland Lake Pro-Life	N			Advocacy	Alliance for Life Ont.	Kirkland Lake	ON		www.klprolife.com/											
141.0	Kitchener-Waterloo & Area Right to Life Association	Y	107896599	Poverty	Advocacy		Kitchener- Waterloo	ON	The Right to Life Association of Kitchener-Waterloo and Area	www.kwrtl.ca/											
142.0	La Roseliere	Y	836175166	Poverty	CPC		Québec	QC		https://laroseliere.org/ www.facebook.com/RoseliereGrossesseIm prevue/ www.youtube.com/channel/UCMoCaxsvW -H0KKy3Fa1x-rQ/videos www.instagram.com/laroselieregrossessei mprev/	"They do presentations in schools, secondary and college level. https://laroseliere.org/nos- services/formation-et- ressourcement/clientele-etudiante/ “Our workshops fit very well into the detailed content of sexuality education in the fifth secondary produced by the Ministry of Education and Higher Education”"										
143.0	Lambton Crisis Pregnancy Centre	Y	135676872	Poverty	CPC	PCC / Heartbeat Int’l / Care Net / Evangelical	Sarnia	ON	The Pregnancy Options & Support Centre (Petrolia branch was closed)	www.pregnancycentre.org www.facebook.com/ThePregnancyOptions AndSupportCentre/ www.facebook.com/HeartsHopeHealing www.instagram.com/pregnancyoptionssup portsarnia/ www.youtube.com/watch?v=- T1MHXmqyVw											
144.0	Lambton Right to Life	Y	107594277	Poverty	Advocacy	Alliance for Life Ont.	Sarnia	ON	Runs maternity home: Gianna Home for Life & Family.	http://lambtonrighttolife.org/	"“We gather pro-life resources in our office that are available to the community – individuals as well as schools and other organizations. We have tapes, slides, literature and fetal models and are prepared to visit schools, churches, and societies by invitation.”"										
145.0	Lethbridge & District Pro- life Association	Y	119018307	Poverty	Advocacy	Works with Knights of Columbus	Lethbridge	AB		www.lifelethbridge.org	“Providing schools and Homeschooled families with education resources”										
146.0	Lethbridge Pregnancy Care Centre	Y	805840337 RR0002	"Community Org., Health"	CPC	PCC / Evangelical	Lethbridge	AB		www.lethbridgepregcentre.com www.facebook.com/pages/Lethbridge- Pregnancy-Care- Centre/439520856132151 https://twitter.com/lethpregcentre www.instagram.com/lethbridgepregcentre /											
147.0	Life Centre (The)	Y	894249770	Poverty	CPC	PCC / Heartbeat Int’l / Care Net / Evangelical	Newmarket	ON	Legal name:  Life Is for Everyone Crisis Pregnancy Centre (Newmarket) Inc. / TLC Pregnancy Centre	www.tlcthelifecentre.ca www.facebook.com/TLCTheLifeCentre www.instagram.com/tlcthelifecentre.ca/											
148.0	Life Compass Society	N			Advocacy	LifeCanada	Coquitlam	BC		https://lifecanada.org/lifecompass/ www.facebook.com/Life-Compass- Society-764898846981082/	Nothing specifically on sex-ed. Uses Life Canada Kids. (See LifeCanada National Assoc)										
149.0	Life Culture Canada Inc.	Y	119010163	Poverty	Advocacy		Steinbach	MB	Life's Vision Manitoba Inc. / League for Life	www.lifeculture.ca/ www.facebook.com/LifeCulture.ca/ www.instagram.com/lifeculture.ca/ https://twitter.com/lifecultureca Also runs these 2 websites: www.generationlife.ca https://angelbaby.ca/	They “teach life-affirming education” but don’t say where or how.										
150.0	Life in Motion	N			Advocacy		Chatham	ON	Run by Right to Life Kent	https://lifeinmotionchatham.ca/											
151.0	Life Wood Buffalo Society	N			Advocacy	LifeCanada	Wood Buffalo	AB		https://lifecanada.org/lifewood/ www.facebook.com/profile.php?id=10003 2983106337											
152.0	Life ’s Vision Brandon	N			Advocacy	LifeCanada	Brandon	MB		https://lifesvisionbrandon.weebly.com/ www.facebook.com/ManitobaYouthForLife (not updated since 2016)	Presentations given to school and youth groups										
153.0	Life Canada National Association	Y	119282176	Poverty	Advocacy		West Vancouver	BC	LifeCanada Life Collective	https://lifecanada.org/	"Nothing specifically on sex-ed https://lifecanada.org/our-work/ They have “LifeCanada Kids”, an “initiative that brings pro-life education to children and youth. Our resources help parents and grandparents guide their kids through life issues, to cultivate wisdom and virtue.”"										
154.0	Life SiteNews.com	N			Advocacy		Toronto	ON		www.LifeSiteNews.com											
155.0	Lindsay Right to Life Organization (The)	Y	119242220	Poverty	Advocacy	Alliance for Life Ont.	Lindsay	ON		https://allianceforlifeontario.ca/lindsay- right-to-life/											
156.0	Listowel and District Right to Life	N			Advocacy	Alliance for Life Ont.	Listowel	ON		www.facebook.com/listowel.right.to.life/											
157.0	London Against Abortion	N			Advocacy	CCBR (trained by)	London	ON		CCBR: www.endthekilling.ca https://londonagainstabortion.wordpress.c om/ www.facebook.com/LondonAgainstAbortio n/ https://twitter.com/LdnAntiAbortion www.instagram.com/londonagainstabortio n/											
158.0	London Area Right to Life Association Inc.	Y	107641573	Poverty	Advocacy	Alliance for Life Ont.	London	ON		http://right2life.ca/ (website under construction) www.facebook.com/LondonRightToLife/											
159.0	London Pregnancy and Family Support Centre	Y	135875649	Poverty	CPC	PCC / Heartbeat Int’l / Care Net / Evangelical	London	ON	London Crisis Pregnancy Centre [name change]	www.notalone.ca www.facebook.com/LPFSC/ https://twitter.com/lonpfsc	Sex. Think. Decide. One-hour interactive PowerPoint presentation. (Doesn’t specify public/religious schools or grade/age of target audience... but testimonies are from grade 7-8 teachers) https://lonpfsc.com/schools/ Resources for educators: https://lonpfsc.com/educators/										
160.0	Love4Life	Y	119282176	Poverty	CPC		West Vancouver	BC	Abortionincanada.c a	https://love4life.ca/											
161.0	Lutherans for Life – Canada	N			Advocacy	Alliance for Life Ont.	St. Catharines	ON		http://lutheransforlife-canada.ca/											
162.0	Macklin Denzil Pro-life Association	Y	119027258	Poverty	Advocacy	Saskatchewan Pro- Life	Cactus Lake	SK	Macklin Pro-life Association	www.saskprolife.com/macklindenzilprolife											
163.0	Mainsprings Pregnancy and Family Support Association	Y	118823442	Poverty	CPC	Christian	Airdrie	AB	Formerly: Calgary Pregnancy Care Centre Association	www.pregcare.com	“Take Charge” (school) www.pregcare.com/sexual-health- education/ www.pregcare.com/education										
164.0	Mainsprings Pregnancy and Family Support Association	Y	118823442	Poverty	CPC	Christian	Calgary	AB	Formerly: Calgary Pregnancy Care Centre Association	www.pregcare.com	“Take Charge” (school) www.pregcare.com/sexual-health- education/ www.pregcare.com/education										
165.0	Mainsprings Pregnancy and Family Support Association	Y	118823442	Poverty	CPC	Christian	Strathmore	AB	Formerly: Calgary Pregnancy Care Centre Association	www.pregcare.com	“Take Charge” (school) www.pregcare.com/sexual-health- education/										
166.0	Markham/Stouffville Crisis Pregnancy Centre Inc.	Y	888451861	Poverty	CPC	PCC / Heartbeat Int’l / Care Net / Evangelical	Markham	ON	The Crisis Pregnancy Centre	https://mscpc.org/ www.facebook.com/mscpregcentre www.instagram.com/mscpregcentre/	"Offers community education https://mscpc.org/be- involved/#community-education Community workshops, topics include hygiene, finance, nutrition, relationships, and more."										
167.0	Matercare International (Canada) Incorporated	Y	874266943	"Community Org., Health"	Advocacy	Catholic Church	St. John’s	NL	Matercare International (Catholic Ob/Gyns)	www.matercare.org											
168.0	Mea Centre: Pregnancy Support Services	Y	139137020	Poverty	CPC	PCC / Heartbeat Int’l / Care Net / Evangelical	Kingston	ON	Kingston Crisis Pregnancy Centre Inc.	www.meacentre.ca/ www.facebook.com/MeaCentre www.instagram.com/meacentre/	"R.S.V.P. Relationships, Sexuality, Value, Power; “workshops by trained presenters are offered free of charge” https://meacentre.ca/community- education “All school presentations are a result of a teacher’s request or school’s invitation” Grades 7-12. Abstinence-based. “our curriculum is available by request for anyone wishing to understand what it is will cover in the classroom.”"										
169.0	Mea Centre: Pregnancy Support Services	Y	139137020	Poverty	CPC	PCC / Heartbeat Int’l / Care Net / Evangelical	Napanee	ON	Kingston Crisis Pregnancy Centre Inc.	www.meacentre.ca/ www.facebook.com/MeaCentre www.instagram.com/meacentre/	"R.S.V.P. Relationships, Sexuality, Value, Power; “workshops by trained presenters are offered free of charge” https://meacentre.ca/community- education “All school presentations are a result of a teacher’s request or school’s invitation” Grades 7-12. Abstinence-based. “our curriculum is available by request for anyone wishing to understand what it is will cover in the classroom.”"										
170.0	Melo Clinic & Pregnancy Centre	Y	134414176	Poverty	CPC	PCC / Heartbeat Int’l / Care Net / Evangelical	Leamington	ON	Formerly Sunparlour Pregnancy & Resource Centre	http://pregnancycentre.net www.facebook.com/SunParlour- Pregnancy-and-Resource-Centre- 379177242117071/	"Sexual Health And Relationships Education Let’s Talk About Sex... https://pregnancycentre.net/school- and-community-education/ “Our instructors can come to your school or community building for presentations. Our presentations are 100% free to schools” (doesn’t specify public/religious, or target audience)"										
