num	name	is_charity	charity_num	charity_type	org_type	affiliate_of	city	province	other_names	website_and_social_media	sex_ed_programs										
269.0	SouthFraser Pregnancy Options Centre	Y	119297497	Poverty	CPC	PCC / Heartbeat Int’l / Care Net / Evangelical	Surrey	BC	Crisis Pregnancy Centre of Surrey / CPC of Surrey	www.pregnancyoptionscentre.com www.facebook.com/popartners http://instagram.com/pregnancyoptionspa rtners	"STAND program: www.iwillstand.org/ Says over 700 students reached in Surrey, Langley, Delta and surrounding areas.  Program Guide History: “Sexual Integrity Community Education” was in schools but blocked in 2012."										
270.0	St. Joseph's Workers for Life and Family	Y	135142834	Religion	Advocacy	Catholic Church	Ottawa	ON		www.sjw.ca/	"Mostly pamphlets, books. Prayer cards for schools. www.sjw.ca/prayercards.htm Work to consult with Catholic and secular educators, parents and groups with respect to monitoring and evaluating the availability and suitability of family life (sex education) studies in both Catholic and public school systemsp"										
271.0	St. Thomas and District Right to Life	Y	119119915	Poverty	Advocacy	LifeCanada Alliance for Life Ont.	St. Thomas	ON	Respect for Life St. Thomas Right to Life	www.respectforlife.ca/ www.facebook.com/Right2LifeStT											
272.0	Stratford & District Right to Life Association	Y	119199990	Poverty	Advocacy	LifeCanada Alliance for Life Ont.	Stratford	ON	Stratford Right to Life	www.stratfordright2life.ca/											
273.0	Strathroy & District Right to Life	N			Advocacy	Alliance for Life Ont.	Strathroy	On	Strathroy Right to Life	www.facebook.com/Strathroy-and- District-Right-to-Life- 751235924920967/											
274.0	Sudbury Right to Life	Y	119205128	Poverty	Advocacy	Alliance for Life Ont.	Sudbury	ON		https://allianceforlifeontario.ca/sudbury- right-to-life%E2%80%A8/ www.facebook.com/sudburylife/											
275.0	Sunrise Pregnancy and Family Support Services	Y	889773123	Poverty	CPC		Uxbridge	ON		www.sunriseuxbridge.com/ www.facebook.com/sunriseuxbridge/ www.instagram.com/sunrise.uxbridge/											
276.0	Surrey-Delta Pro-life Society	N			Advocacy		Surrey	BC													
277.0	Sussex And Area Crisis Pregnancy Centre Inc.	Y	135608982	Poverty	CPC	PCC / Heartbeat Int’l / Care Net / Evangelical	Sussex	NB	Sussex Pregnancy Care Centre	www.sussexpregnancycare.com www.facebook.com/PregnancyCareCentre Sussex/ http://twitter.com/SussexPregnancy http://instagram.com/sussexpregnancycar ecentre	Sexual Health Education presentations (does not specifically mention schools). www.sussexpregnancycare.com/about										
278.0	Swift Current & District Pro-life	N			Advocacy	LifeCanada	Swift Current	SK	Swift Current Pro- life	www.swiftcurrentprolife.com/											
279.0	Taber Pro-life Association	N			Advocacy		Taber	AB		www.facebook.com/pages/category/Com munity/Taber-Prolife- 880379625382243/											
280.0	Teen-Aid North West Association Corp.	Y	108066630	Poverty	Abstinenc e Education		Saskatoon	SK													
281.0	Teen-Aid Saskatoon Inc.	Y	131433724	"Community Org., Resource"	Abstinenc e Education		Saskatoon	SK		www.teenaidsaskatoon.com	"Teen-Aid Chastity www.teenaidsaskatoon.com/Teen- Aid_Saskatoon/Home.html Education based on “resisting sexual pressure”, chastity, “responsible sexuality”, “why we don’t teach safe- sex”"										
282.0	Terrace Pro-Life Education Society	N			Advocacy		Terrace	BC		No website or social media											
283.0	Tiger Mountain League for Life	N			Advocacy	Heartbeat Int’l	Holland	MB		www.facebook.com/TMleagueforlife/											
284.0	Tillsonburg Right to Life	N			Advocacy	Alliance for Life Ont.	Tillsonburg	ON	Chapter of Oxford County Right to Life	https://allianceforlifeontario.ca/tillsonburg -right-to-life/											
285.0	Together for Life	N	852722594 (Artists in Christian Testimony Canada Inc.)	Religion	Advocacy		Sturgeon County	AB	Associated with Artists in Christian Testimony Canada. Also see Canada Silent No More	https://togetherforlife.net/											
286.0	Toronto Against Abortion	N			Advocacy	CCBR (trained by)	Toronto	ON		CCBR: www.endthekilling.ca www.torontoagainstabortion.org/ https://twitter.com/endthekillingTO www.facebook.com/torontoagainstabortio n											
287.0	Tri-County Pregnancy Care Centre Association	Y	866619273	"Community Org., Health"	CPC	PCC / Heartbeat Int’l / Care Net / Evangelical	Yarmouth	NS		www.tricountypregnancycarecentre.ca www.facebook.com/tricounty.centre http://instagram.com/wix	Abstinence Focused Sexual Health Education (does not specifically mention schools) www.tricountypregnancycarecentre.ca/ #!services/c21kz										
288.0	Valley Care Pregnancy Centre	Y	897478269	"Community Org., Health"	CPC	Heartbeat Int’l / Care Net	Kentville	NS	"The Valley Care Pregnancy Centre, A Christian Outreach Ministry"	http://asafeplaceforme.com	Relationship education & presentations www.asafeplaceforme.com/services										
289.0	Vancouver Life Soldiers	N			Advocacy	Catholic Church (Archdiocese of Vancouver)	Vancouver	BC		https://beholdvancouver.org/events/vanc ouver-life-soldiers-friday-night-zoom- rosary											
290.0	Vancouver Right to Life Society	Y	119282176	Poverty	Advocacy	LifeCanada	Vancouver	BC	Runs Vancouver’s Life Community	https://lifecanada.org/vancouver www.facebook.com/Vancouvers-Life- Community-1538472686451716/	"Used to offer The Principles and Choices Curriculum to high school students, but no longer on website as of Oct 22."										
291.0	Vancouver’s Life Community	Y	119282176	Poverty	Advocacy	LifeCanada	West Vancouver	BC	(Emerged from Vancouver Right to Life Society)	https://lifecanada.org/vancouver											
292.0	Vernon and Area Pro-life Society	Y	119283216	Poverty	Advocacy	LifeCanada	Vernon	BC		www.prolifevernon.ca/ www.facebook.com/Vernon-and-Area-Pro- Life-Society-369228856766660											
293.0	Vernon Live Well Clinic for Sexual Health and Pregnancy Association	Y	824273379	"Community Org., Health"	CPC	PCC / Heartbeat Int’l / Care Net / Evangelical	Vernon	BC	North Okanagan Pregnancy Care Centre	www.vernonpregnancy.com www.facebook.com/VernonLiveWellClinic/ https://twitter.com/vernonpregnancy www.youtube.com/channel/UCJdfAmUMO nIpGx72_M2kJZQ	"“Community Education is for anyone seeking information about healthy relationships and sexuality. Our instructors can come to your school or community building for presentations. Our presentations are 100% free to schools, groups, or organizations within the greater Vernon area. Learn more at resonateeducation.com,  or to book a presentation.” However, Resonate appears to be an aggregator site and has nothing related to sex-ed."										
294.0	Visitation Centre Pregnancy Support	Y	807557624	Religion	CPC	Heartbeat Int’l	Toronto	ON	Run by Sisters of Life Canada	www.visitationcentreca.org/ www.sistersoflife.org/visitation-mission- pregnancy-help	Appears to go on lent/advent missions to different schools across the US										
295.0	Walkerton & District Right to Life	N			Advocacy	LifeCanada Alliance for Life Ont.	Walkerton	ON	Runs “Second Hand Rose Shop”	https://allianceforlifeontario.ca/walkerton- district-right-to-life/											
296.0	"Waterloo Region Against Abortion (Kitchener, Waterloo, Cambridge)"	N			Advocacy	CCBR (trained by)	Waterloo region	ON		CCBR: www.endthekilling.ca www.facebook.com/wragainstabortion/ www.instagram.com/wragainstabortion											
297.0	We Need a Law	N			Advocacy	ARPA Canada LifeCanada	Ottawa	ON	Run by Association for Reformed Political Action (ARPA) Canada	https://weneedalaw.ca	"They have three “Teacher Guides” for schools: Pro-life 101, Sex-Selective Abortion, and Pre-Born Victims of Crime: https://weneedalaw.ca/resources/teachi ng-materials/ And they use this ARPA video as a teaching tool: www.youtube.com/watch?v=Lct61MEb0 1Q"										
298.0	Wee Care Pregnancy Centre	N			CPC	PCC	Castlegar	BC	Trail Pregnancy Care Centre	https://weecarepc.ca/	(Applied for charity tax status Jan 2022)										
299.0	Welland Port Colborne Pro Life	N			Advocacy	Alliance for Life Ont.	Welland	ON		http://wpcprolife.com/											
300.0	Wellington Pregnancy Care Centre	Y	732888532	"Community Org., Health"	CPC		Fergus	ON	(Former satellite of the Pregnancy Centre Kitchener- Waterloo)	www.facebook.com/Wellington- Pregnancy-Care-Centre- 106468068335366 www.instagram.com/wellington_pcc/											
301.0	West Yellowhead Pregnancy Care Centre	Y	889893186	"Community Org., Health"	CPC	PCC / Heartbeat Int’l / Care Net / Evangelical	Edson	AB	Hinton Crisis Pregnancy Association	www.wypcc.ca/ www.facebook.com/pages/category/Nonp rofit-Organization/West-Yellowhead- Pregnancy-Care-Centre- 272370656280555/	"Healthy Relationships Presentations, Grade 5 to 12. www.wypcc.ca/services.html"										
302.0	West Yellowhead Pregnancy Care Centre	Y	889893186	"Community Org., Health"	CPC	PCC / Heartbeat Int’l / Care Net / Evangelical	Hinton	AB	Hinton Crisis Pregnancy Association	www.wypcc.ca/ www.facebook.com/pages/category/Nonp rofit-Organization/West-Yellowhead- Pregnancy-Care-Centre- 272370656280555/	"Healthy Relationships Presentations, Grade 5 to 12. www.wypcc.ca/services.html"										
303.0	West Yellowhead Pregnancy Care Centre	Y	889893186	"Community Org., Health"	CPC	PCC / Heartbeat Int’l / Care Net / Evangelical	Whitecourt	AB	Hinton Crisis Pregnancy Association	www.wypcc.ca/ www.facebook.com/pages/category/Nonp rofit-Organization/West-Yellowhead- Pregnancy-Care-Centre- 272370656280555/	"Healthy Relationships Presentations, Grade 5 to 12. www.wypcc.ca/services.html"										
304.0	Weyburn & District Pro- life	Y	119296572	Poverty	Advocacy	Sask. Pro Life	Weyburn	SK		www.saskprolife.com/organization/regions _wb											
305.0	Whitehorse Right to Life	N			Advocacy	LifeCanada	Whitehorse	YK		www.whrighttolife.org/											
306.0	Wilberforce Project	N			Advocacy		Edmonton	AB	Formerly Alberta Pro-Life Alliance Association	www.thewilberforceproject.ca/											
307.0	Windsor Against Abortion	N			Advocacy	CCBR (trained by)	Windsor	ON		CCBR: www.endthekilling.ca www.facebook.com/WindsorAgainstAborti on											
308.0	Windsor-Essex Right to Life Association	Y	119299618	Poverty	Advocacy	Alliance for Life Ont.	Windsor	ON	Windsor & Area Right to Life Association / Windsor Essex County Right to Life Association	www.facebook.com/Windsor-Essex-Right- To-Life-Association- 168661716543991/	.										
309.0	Wingham & District Right to Life	N			Advocacy	Alliance for Life Ont.	Wingham	ON	Wingham Right to Life Wingham Voice for Life	http://winghamright2life.com/who/											
310.0	WomanCare Pregnancy Centre	Y	890847064	Poverty	CPC	PCC / Heartbeat Int’l / Care Net / Evangelical	Maple Ridge	BC	British Columbia Familycare Foundation	www.womancarepc.ca www.facebook.com/WomanCare- Pregnancy-Centre-241300152595319/ www.instagram.com/womancarepregnanc ycentre/											
311.0	Women’s Care Centre / Centre de soins pour femmes	Y	891337990	Poverty	CPC	Heartbeat Int’l	Fredericton	NB	Run by New Brunswick Right to Life Association Inc.	http://womenscarecenter.ca/											
312.0	Woodstock Right to Life	N			Advocacy	Alliance for Life Ont.	Woodstock	ON	Oxford Country / Woodstock Right to Life (Chapter of Oxford County Right to Life)	https://allianceforlifeontario.ca/oxford- county-woodstock-right-to-life/											
313.0	Your Pregnancy Options	Y	894419290	Poverty	CPC	Christian	Maple Ridge	BC	Fraser Valley Crisis Pregnancy Society / Ventura 301 /	No website or social media; refers to WomanCare Pregnancy Centre Some info here: https://mission.fetchbc.ca/service.htm l?i=328											