num	name	is_charity	charity_num	charity_type	org_type	affiliate_of	city	province	other_names	website_and_social_media	sex_ed_programs										
171.0	Melo Clinic & Pregnancy Centre	Y	134414176	Poverty	CPC	PCC / Heartbeat Int’l / Care Net / Evangelical	Windsor	ON	Formerly Sunparlour Pregnancy & Resource Centre	http://pregnancycentre.net www.facebook.com/SunParlour- Pregnancy-and-Resource-Centre- 379177242117071/	"Sexual Health And Relationships Education Let’s talk about sex... https://pregnancycentre.net/school- and-community-education/ “Our instructors can come to your school or community building for presentations. Our presentations are 100% free to schools” (doesn’t specify public/religious, or target audience)"										
172.0	Miriam Centre for Mothers in Need Foundation / La fondation du centre Miriam pour meres dans le besoin	Y	876121625	"Community Org., Foundations"	CPC		Orléans (2742 St. Joseph Blvd.)	ON	Centre Miriam	https://miriamcentre.ca/											
173.0	Miriam Centre For Mothers in Need of Ottawa Carleton Inc.	Y	119042091	Poverty	CPC		Orléans (1803 St. Joseph Blvd.)	ON	Miriam Centre	https://miriamcentre.ca/											
174.0	Moose Jaw Right to Life	Y	119045649	Poverty	Advocacy	LifeCanada (Catholic Women’s League and Knights of Columbus provide financial support)	Moose Jaw	SK		http://moosejawrighttolife.ca/											
175.0	My Canada Association	N			Advocacy		Grimsby	ON		http://4mycanada.ca/wp/											
176.0	National Campus Life Network	N			Advocacy		Toronto	ON		www.ncln.ca											
177.0	National March for Life	N			Advocacy	Campaign Life Coalition	Ottawa	ON		www.marchforlife.ca/ www.facebook.com/MarchforLifeCanada/ https://twitter.com/CampaignLife www.youtube.com/channel/UCTO7pYzIIP8 u6ApRHtCsI6g											
178.0	Nesting Place Society	Y	889587267	Poverty	CPC	PCC / Evangelical	Courtenay (Comox)	BC	Comox Valley Pregnancy Care Centre	www.nestingplacesociety.com											
179.0	New Brunswick Right to Life Association Inc. / Association Pour Le Droit-A La Vie Du N B Inc.	Y	891337990	Poverty	Advocacy		Fredericton	NB	Runs Women’s Care Centre	www.facebook.com/NBRightToLife/											
180.0	Niagara Against Abortion	N			Advocacy	CCBR (trained by)	Niagara region	ON		CCBR: www.endthekilling.ca www.facebook.com/niagaraagainstabortio n											
181.0	Niagara Life Centre	Y	138724463	"Community Org., Health"	CPC		St. Catharines	ON		http://niagaralifecentre.ca/ www.facebook.com/Niagara-Life-Centre- 385042381512/ https://twitter.com/niagaralifectr www.instagram.com/niagaralifecentre/											
182.0	Niagara Region Right to Life	Y	889289245	Poverty	Advocacy		Toronto	ON		http://niagararegionrighttolife.ca/											
183.0	Norfolk Pregnancy Centre Inc.	Y	823065370	"Community Org., Health"	CPC	PCC / Heartbeat Int’l https://twitter.co m/ReproJustice_H N/status/1629459 996734783488 Funded by United Way of Haldimand and Norfolk (Aug 2017). https://twitter.co m/ReproJustice_H N/status/9713542 82128650240/pho to/1	Delhi	ON		www.norfolkpc.org www.facebook.com/norfolkpregnancycent re www.instagram.com/norfolkpc/											
184.0	Norfolk Pregnancy Centre Inc.	Y	823065370	"Community Org., Health"	CPC	PCC / Heartbeat Int’l	Simcoe	ON		www.norfolkpc.org www.facebook.com/norfolkpregnancycent re www.instagram.com/norfolkpc/											
185.0	North Bay Pregnancy Help and Resource Centre	Y	774536338	"Community Org., Health"	CPC	Pro-Cathedral of the Assumption	North Bay	ON		www.facebook.com/pages/category/Charit y-Organization/North-Bay-Pregnancy- Help-and-Resource-Centre-NBPHRC- 102473048203500/											
186.0	North Bay Right to Life	N			Advocacy	LifeCanada Alliance for Life Ont.	North Bay	ON		www.facebook.com/Right-to-LifePro-Vie- North-Bay-106970054185231											
187.0	North Peace Pregnancy Care Centre Society	Y	869389940	"Community Org., Health"	CPC	PCC / Heartbeat Int’l / Care Net / Evangelical	Fort St. John	BC		www.northpeacepregnancycare.ca www.facebook.com/NorthPeacePregnancy CareCentre/ www.instagram.com/np_pregnancy_care/											
188.0	North Shore Pro-Life Society	N			Advocacy		North Vancouver	BC		www.northshoreprolife.org/ https://en- gb.facebook.com/groups/northshorep rolife/ (private group)											
189.0	Northeast Pregnancy Options	Y	131891517 (church #)	Religion	CPC	Northeast Christian Fellowship	Melfort	SK	Run by Northeast Christian Fellowship	www.northeastpregnancyoptions.com/ www.facebook.com/NortheastPregnancyO ptions www.instagram.com/nepregnancyoptions/											
190.0	Nova Scotians United for Life	Y	119063501	Poverty	Advocacy	LifeCanada	Halifax	NS	Associated with Project Rachel	https://lifecanada.org/nova-scotia											
191.0	Nurture Pregnancy Centre	Y	121683767	Poverty	CPC	Christian	Medicine Hat	AB	Medicine Hat Pregnancy Support Society / Pregnancy & Family Support Centre	http://nurturepregnancycentre.ca www.facebook.com/Nurturepregnancycen tre https://instagram.com/nurturepregnancyc entre	"Educational classes, but not for schools. (Parenting, Relationships, Prenatal and Postnatal Care, Mental Health, Sewing and Cooking) http://nurturepregnancycentre.ca/educ ation"										
192.0	Okanagan Valley Pregnancy Care Centre	Y	863797171	"Community Org., Health"	CPC	PCC / Heartbeat Int’l / Care Net / Evangelical	Kelowna	BC		www.ovpcc.com www.facebook.com/OVPCC/ www.instagram.com/okanaganpregnancyc are/?hl=de	"“True to You” education program offered to schools (gr 7 - 12) , youth groups, organizations and parents: www.ovpcc.com/education www.truetoyouokanagan.com Testimonials: https://www.truetoyouokanagan.com/w hat-people-are-saying-about-usDoes not specify where they come from unfortunately"										
193.0	OnlineCare.ca	Y	136223971	Poverty	CPC		(Online)	NAT	Run by Christian Advocacy Society of Greater Vancouver	www.onlinecare.ca											
194.0	Open Door Women's Care Centre	Y	107461485	Poverty	CPC		Halifax	NS	Open Door Centre / Halifax Metro Crisis Pregnancy Centre	www.opendoorcentre.com www.facebook.com/opendoorwomencent re https://opendoorcentre.com/	"2 educational programs; one on exploited youth (Hey); one on sex ed (Up). Available for ""classrooms"". No schools mentioned. Hey Presentation: https://opendoorcentre.com/sexual- exploitation/hey-presentations Up Presentation: www.opendoorcentre.com/pregnancy/e ducational-presentations/hlc- presentations"										
195.0	Options grossesse	Y	813676954	"Community Org., Resource"	CPC	Heartbeat Int’l	Québec City	QC	Centre Conseils- Grossesse	www.optionsgrossesse.com/ www.facebook.com/pages/Options- Grossesse-Centre-conseils-grossesse- de-Qu%C3%A9bec/160113584756	"www.optionsgrossesse.com/nos- services “We provide information on topics such as pregnancy, abortion, fetal development, child rearing, adoption, and sexually transmitted infections.” No mention of school education."										
196.0	"Options Pregnancy Center, Resources and Lifestyle Coaching Inc."	Y	129777298	Poverty	CPC	PCC / Heartbeat Int’l / Care Net / Evangelical	Regina	SK		www.reginapregnancy.com www.facebook.com/OptionsPregnancyCen ter/  www.instagram.com/options_pregnancy_c enter_/?hl=en											
197.0	Orillia Pregnancy Resource Centre	Y	891126286	"Community Org., Health"	CPC	PCC / Heartbeat Int’l / Care Net / Evangelical	Orillia	ON	Orillia Pregnancy Resource Center	www.prcorillia.ca www.youtube.com/channel/UCLDvT5- PJiNtY92k0A4QAcg/											
198.0	Ottawa Youth for Life	N			Advocacy		Ottawa	ON		http://oyl.awardspace.com/											
199.0	Outreach for Life Association of Edmonton	Y	119074623	Poverty	CPC	PCC / Care Net / Evangelical	Edmonton	AB	Edmonton Pregnancy Care Centre / Pregnancy Care Centre / Abortion Recovery Centre	www.pregnancycarecentre.ca www.facebook.com/pccedmonton	“Wait! Let’s Talk Sex” www.pregnancycarecentre.ca/healthy- teen-relationships/										
200.0	Oxford Against Abortion	N			Advocacy	CCBR (trained by)	Oxford county	ON		CCBR: www.endthekilling.ca www.facebook.com/Oxford-Against- Abortion-251438635198432/											
201.0	Oxford County Right to Life	Y	131621906	Poverty	Advocacy		Woodstock	ON		https://oxfordcountyrighttolife.com/											
202.0	Peace for Life Society	N			Advocacy	LifeCanada	Dawson Creek	BC		https://lifecanada.org/peaceforlife/ www.facebook.com/groups/peaceforlifeso ciety (private)	Nothing specifically on sex-ed. Uses Life Canada Kids. (See LifeCanada National Assoc)										
203.0	Peace Pregnancy Support Society	Y	841117997	"Community Org., Health"	CPC	PCC / Heartbeat Int’l / Care Net / Evangelical	Dawson Creek	BC		www.peacepregnancysupport.com/ www.facebook.com/Peace-Pregnancy- Support-Centre-1420191944900625/											
204.0	PEI Life Association Inc.	Y	851861443	Poverty	Advocacy		Charlottetown	PE	PEI Right to Life Association Inc.	www.peilife.org/ www.facebook.com/PEIRTL/											
205.0	Pembina Pro-life	N			Advocacy	Supports Wilberforce	Barrhead / Pembina	AB		www.facebook.com/pembinaprolife/											
206.0	Pembina Valley Pregnancy Care Centre	Y	107832057	Poverty	CPC	PCC / Heartbeat Int’l / Evangelical	Altona	MB		www.pvpcc.com www.facebook.com/pvpregnancycarecentr e www.instagram.com/pvpregnancycare/?hl =en											
207.0	Pembina Valley Pregnancy Care Centre	Y	107832057	Poverty	CPC	PCC / Heartbeat Int’l / Evangelical	Winkler	MB		www.pvpcc.com www.facebook.com/pvpregnancycarecentr e www.instagram.com/pvpregnancycare/?hl =en											
208.0	Pembina Valley Pregnancy Care Centre Inc.	Y	107832057	Poverty	CPC	PCC / Heartbeat Int’l / Evangelical	Morden	MB		www.pvpcc.com www.facebook.com/pvpregnancycarecentr e www.instagram.com/pvpregnancycare/?hl =en											
209.0	Peterborough Pregnancy Support Services	Y	129800116	"Community Org., Resource"	CPC	PCC / Heartbeat Int’l / Care Net / Evangelical	Peterborough	ON		www.mypregnancycentre.org www.facebook.com/PeterboroughPregnan cy Twitter: @Ptbo_Canada @downtownPtbo	"Pause and Think (in schools). www.mypregnancycentre.org/relationsh ips Community/school education: awareness about sexual health, healthy relationships, learn the risks of sexual activity, how to develop personal boundaries, how to identify healthy relationships"										
210.0	Peterborough Pro Life Association	N			Advocacy	Alliance for Life Ont.	Peterborough	ON		http://peterboroughprolife.com/											
211.0	Pharmacists for Life International - Canada	N			Advocacy		Calgary? (U.S. based org)	AB		www.pfli.org/											
212.0	Post-Abortion Community Services	Y	136223971	Poverty	CPC	PCC / Heartbeat Int’l / Evangelical	Burnaby	BC	Run by Christian Advocacy Society of Greater Vancouver	www.pacscanada.org/	"None, but their two CPCs offer the SHARE program."										
213.0	Prairie Pregnancy Support Centre	Y	703593327	"Community Org., Health"	CPC	PCC / Heartbeat Int’l / Care Net / Evangelical	Portage La Prairie	MB		www.prairiepregnancy.com www.facebook.com/prairiepregnancy											
214.0	Pregnancy & Family Care of Quinte West	Y	773623509	Poverty	CPC	PCC / Heartbeat Int’l / Care Net / Evangelical	Trenton	ON	(new tax # as of Jan 2023) Satellite of Belleville Pregnancy and Family Care Centre	www.pfcqw.ca www.facebook.com/Pregnancy-and- Family-Care-of-Quinte-West- 261165260685238/	4U Community Education Program for schools (same topics as Take Charge) http://bellevillepregnancyandfamilycare centre.com/community-education.php Belleville still offering 4U										
215.0	Pregnancy & Wellness Centre of Moncton Inc.	Y	119044287	Poverty	CPC	PCC / Heartbeat Int’l / Care Net / Evangelical	Moncton	NB	Pregnancy Resource Centre of Moncton / Moncton Crisis Pregnancy Centre Inc.	www.monctonwellness.ca/ www.facebook.com/Pregnancy-Wellness- Centre-of-Moncton- 198205426863388/ https://twitter.com/monctonwellness											
216.0	Pregnancy Care & Family Support Centre	Y	862146230	Poverty	CPC	PCC / Heartbeat Int’l / Care Net / Evangelical	Haliburton	ON	Highlands Community Pregnancy Care Centre Inc.	www.haliburtonpregnancycentre.ca www.facebook.com/HaliburtonPregnancyC entre/	“Sexual health and pregnancy education.” Details unspecified https://www.haliburtonpregnancycentre .ca/who-are-we										
217.0	Pregnancy Care Canada	Y	880400221	Religion	Advocacy	Heartbeat Int’l	Red Deer	AB	Previously Canadian Association of Pregnancy Support Services (CAPSS). Previous to that: Christian Assoc. of Pregnancy Support Services (umbrella group for CPCs)	https://pregnancycarecanada.ca (Was: https://capss.com)											
218.0	Pregnancy Care Centre	Y	119074623	Poverty	CPC	PCC / Care Net / Evangelical	Barrhead	AB	Outreach for Life Association of Edmonton / Edmonton Pregnancy Care Centre / Pregnancy Care Centre / Abortion Recovery Centre 	www.pregnancycarecentre.ca www.facebook.com/pccedmonton?fref=ts / https://twitter.com/PCCyeg www.instagram.com/pccedmonton/											
219.0	Pregnancy Care Centre	Y	107786683	Poverty	CPC	PCC / Heartbeat Int’l / Care Net / Evangelical	North York	ON	Pregnancy Care Centre Toronto (legal name) /The Pregnancy Care Centre / iamnotalone (Hispanic Centre	www.iamnotalone.ca www.facebook.com/pregnancycarecentre.org/ www.instagram.com/pregnancycarecentre/ www.youtube.com/channel/UCXa9uzzzmMIgsTS7QftJQDw											
220.0	Pregnancy Care Centre	Y	107786683	Poverty	CPC	PCC / Heartbeat Int’l / Care Net / Evangelical	Richmond Hill	ON	Pregnancy Care Centre Toronto (legal name) / The Pregnancy Care Centre / iamnotalone	www.iamnotalone.ca www.facebook.com/pregnancycarecentre.org/ www.instagram.com/pregnancycarecentre/ www.youtube.com/channel/UCXa9uzzzmMIgsTS7QftJQDw											
221.0	Pregnancy Care Centre	Y	107786683	Poverty	CPC	PCC / Heartbeat Int’l / Care Net / Evangelical	Scarborough	ON	Pregnancy Care Centre Toronto (legal name) / The Pregnancy Care Centre / iamnotalone	www.iamnotalone.ca www.facebook.com/pregnancycarecentre.org/ www.instagram.com/pregnancycarecentre/ www.youtube.com/channel/UCXa9uzzzmMIgsTS7QftJQDw											
222.0	Pregnancy Care Centre	Y	107786683	Poverty	CPC	PCC / Heartbeat Int’l / Care Net / Evangelical	Toronto (downtown)	ON	Pregnancy Care Centre Toronto (legal name) / The Pregnancy Care Centre / iamnotalone	www.iamnotalone.ca www.facebook.com/pregnancycarecentre.org/ www.instagram.com/pregnancycarecentre/ www.youtube.com/channel/UCXa9uzzzmMIgsTS7QftJQDw											
223.0	Pregnancy Care Centre and Infant Food Bank	Y	897203857	Poverty	CPC		Sudbury	ON		www.pccifb.ca/											
224.0	Pregnancy Care Centre Grande Prairie & Area	Y	823564984	"Community Org., Health"	CPC	PCC / Heartbeat Int’l / Care Net / Evangelical	Grande Prairie	AB		https://pccgp.ca www.facebook.com/pccgp/ www.instagram.com/pregcaregp/?hl=en www.youtube.com/channel/UCZBie1h8EO 3ALS6lfRJFL4g											
225.0	Pregnancy Centre (The)	Y	131909046	Poverty	CPC	PCC / Heartbeat Int’l / Care Net / Evangelical	Sault Ste. Marie	ON	Algoma Crisis Pregnancy Centre	http://algomapregnancy.com/ www.facebook.com/algomapregnancy/											
226.0	Pregnancy Concerns	Y	118871078	"Community Org., Health"	CPC	PCC / Heartbeat Int’l / Care Net / Evangelical	Coquitlam	BC	A “service of the” Community Pregnancy Concerns Society	www.pregnancyconcerns.org											
227.0	Pregnancy Crisis Line	N			CPC		North Battleford	SK	(a hotline: 306-446- 4440)												
228.0	Pregnancy Help Centre of Durham	Y	896740768	Poverty	CPC		Durham / Ajax	ON	PHC of Durham Run by Choice 42	www.pregnancyhelp.ca/ www.facebook.com/Pregnancy-Help- Centre-of-Durham-215017985188819/ www.instagram.com/pregnancyhelpcentre ofdurham/	Speaker Series www.pregnancyhelp.ca/community- impact Brochure: http://site- pwed7z6u.dotezcdn.com/uploads/Speak ers%20Series.pdf?v=232811014833 Claims the promotion for this speaker series is approved by Durham District School Board. Four-part series including teen pregnancy and relationships. Doesn’t specify if public/religious. Grades 9-12.										
229.0	Pregnancy Help Centre of Durham	Y	896740768	Poverty	CPC		Oshawa	ON		www.pregnancyhelp.ca/ www.facebook.com/Pregnancy-Help- Centre-of-Durham-215017985188819/ www.instagram.com/pregnancyhelpcentre ofdurham/	"Speaker Series, Relationship Program (in schools) www.pregnancyhelp.ca/community- impact"										
230.0	Pregnancy Resource Centre of Saint John (The)	Y	137152468	Poverty	CPC	PCC / Heartbeat Int’l / Care Net / Evangelical	Saint John	NB	Fundy Crisis Pregnancy Center Inc	www.saintjohnpregnancyresources.com www.facebook.com/sjpregnancyresource/ https://twitter.com/prcofsaintjohn	Looking for abstinence education facilitators (does not mention schools) www.saintjohnpregnancyresources.com /support-us/volunteer										
231.0	Pregnancy Support Centre of Westman Inc.	Y	892903469	Poverty	CPC	PCC / Care Net / Evangelical	Brandon	MB	"Crisis Pregnancy Centre of Westman (As per CRA, possibly Brandon Crisis Pregnancy Centre)"	www.pregnancysupportcentre.ca/ www.cpcbrandon.ca www.facebook.com/pg/pregnancysupport westman/posts/?ref=page_internal www.instagram.com/pregnancysupportwe stman/											
232.0	Priests for LifeCanada / Pretres pro vie Canada	Y	870173242	Religion	Advocacy	Catholic Church	Lindsay	ON	Priests for Life	www.priestsforlifecanada.com/											
233.0	Prince George Pro Life Society	N 			Advocacy		Prince George	BC		"www.facebook.com/PG-Pro-life-Society- 197435860280821/ (not active since Feb 2020, but they still exist)"											
234.0	Project Rachel	Y	119063501	Poverty	CPC	Catholic Church	Halifax	NS	(Nine branches across Canada) Tax status is under Nova Scotians United for Life	www.projectrachel.ca											
235.0	Pro-Life Alberta	N			Advocacy		Calgary	AB	(Political party offering tax credits)	https://prolifealberta.com/											
236.0	Pro-life Cornwall Pro-vie	Y	119105435	Poverty	Advocacy	Alliance for Life Ont. LifeCanada	Cornwall	ON		https://lifecanada.org/cornwall/											
237.0	Pro-life Society of Comox Valley	Y	119105443	Poverty	Advocacy		Black Creek	BC		No website or social media											
238.0	Pro-life Society of Smithers	N			Advocacy	LifeCanada	Smithers	BC	Pro-Life Smithers Care Centre Smithers Pro-Life	https://lifecanada.org/smithers/ www.facebook.com/SmithersProlife/											
239.0	Pro-vie Québec / Quebec Pro-Life	N			Advocacy		Québec City	QC		www.proviequebec.ca/											
240.0	Pro-Woman Pro-Life	N			Advocacy		(Online)	NAT		www.prowomanprolife.org/											
241.0	Publications Vivere Publications Inc.	N			Advocacy		Québec City	QC	Vivere	www.vivere.info/											
242.0	Quinte Right to Life	N			Advocacy	Alliance for Life Ont.	Belleville	ON		https://allianceforlifeontario.ca/quinte- right-to-life/											
243.0	Rachel’s Vineyard	N			CPC	Catholic Church / Diocesan Pastoral Council	National	Nat	"Primarily an American org with some activity in Canada, mainly retreats"	Main Site: www.rachelsvineyard.org/ twitter @RVHealing Instagram @RVHealing www.youtube.com/rachelsvineyard Local chapters: http://rachelsvineyardkelowna.com/ www.facebook.com/rachelsvineyardkelow na?_rdr=p https://beholdvancouver.org/services/crisi s-pregnancy/rachels-vineyard www.facebook.com/Rachelsvineyardsk www.facebook.com/RachelsVineyardThun derBay www.facebook.com/pages/Rachels- Vineyard-Kamloops- Diocese/293561197749460	"(with retreats in Kelowna, Vancouver, Kamloops, retreats.  Saskatchewan, Thunder Bay, and other cities)"										
244.0	REAL Women of Canada  N	N			Advocacy		Ottawa	ON		www.realwomenofcanada.ca/											
245.0	Red Deer & Area Pro-life N	N			Advocacy	LifeCanada	Red Deer	AB	Red Deer Pro-Life	www.facebook.com/RDprolife/ https://lifecanada.org/reddeer/	Presentation comparing abortion to the holocaust was reported in May 2017.										
246.0	Refuge (Pregnancy Resource Centre)	Y	107896607	Poverty	Advocacy		Chatham	ON	Run by Right to Life Kent Inc. / Life in Motion	www.refugechatham.ca www.lifeinmotionchatham.ca/											
247.0	Reg ina Pro-life Association Corporation	Y	119252609	Poverty	Advocacy		Regina	SK		www.reginaprolife.com/											
248.0	Renfrew County Right to Life	N			Advocacy	LifeCanada Alliance for Life Ont.	Pembroke	ON	Calabogie & Renfrew Area Pro- Life	www.facebook.com/RCRTL/											
249.0	Richmond Right to Life Society	Y	816024871	Poverty	Advocacy		Richmond	BC		www.vcn.bc.ca/rrtl/											
250.0	Right to Life Association	Y	119119881	Poverty	Advocacy		St. John’s	NL	Newfoundland Right to Life Pro-Life NL Runs Centre for Life	www.centreforlife.ca/											
251.0	Right to Life Association of Mississauga and Area	Y	888414844	Poverty	Advocacy	Alliance for Life Ont.	Mississauga	ON	Right to Life Mississauga Brampton	https://righttolifemb.com											
252.0	Right to Life Association of Thunder Bay and Area	Y	119119865	Poverty	Advocacy	Alliance for Life Ont. LifeCanada	Thunder Bay	ON	Right to Life Thunder Bay Thunder Bay Right to Life	www.thunderbay.life	"Education tab gone, but now promoting students to start anti-choice clubs in schools. Also provide resources to start this: www.righttolife.to/get- involved/start-a-club/"										
253.0	Right to Life Association of Toronto and Area	Y	119119873	Poverty	Advocacy	Alliance for Life Ont.	Toronto	ON	Toronto Right to Life Toronto & Area Right to Life	https://trtl.ca	Claims to make presentations at Catholic and public schools https://trtl.ca/presentations										
254.0	Right to Life Kent Inc.	Y	107896607	Poverty	Advocacy	LifeCanada Alliance for Life Ont.	Chatham	ON	Runs Life in Motion and the Refuge CPC	www.lifeinmotionchatham.ca/ Refuge Chatham: www.facebook.com/refugechathamfu ge Life in Motion: www.facebook.com/lifeinmotionchath am											
255.0	RightNow	N			Advocacy		Toronto	ON	It Starts Right Now	www.itstartsrightnow.ca/about											
256.0	Room2Grow Pregnancy Centre	Y	809303282	"Community Org., Health"	CPC		Clinton	ON		www.room2grow.info/											
257.0	Rossland-Trail Right to Life Society	Y	119124105	Education	Advocacy	LifeCanada Subordinate to the Signal Hill	Rossland	BC		No website or social media											
258.0	Sanctuary Outreach Pregnancy Support Program	Y	891531048	Poverty	CPC		Guelph	ON	Run by Guelph & Area Right to Life	www.sanctuaryoutreach.com/	Newsletter mentions using a terrarium workshop to attract U of Guelph students to the group/program https://www.canva.com/design/DAFxoo uwqOk/nMUppmWwNwNstKwx1ADhDA /view?utm_content=DAFxoouwqOk&ut m_campaign=designshare&utm_mediu m=link&utm_source=editor#3										
259.0	Saskatchewan Pro-life Association	N			Advocacy	LifeCanada	Regina	SK	Charitable arm: Sask Pro-life Association Educational Trust	www.saskprolife.com/	Offers speakers: www.saskprolife.com/prolife-speakers-1 One speaker is especially for high schools and universities										
260.0	Saskatchewan Pro-life Association Educational Trust	Y	885750638	Education	Advocacy		Regina	SK	Run by Saskatchewan Pro- life Association Inc.	www.saskprolife.com/	Offers speakers: www.saskprolife.com/prolife-speakers-1 One speaker is especially for high schools and universities										
261.0	Saskatoon Pregnancy Option Centre	Y	865304430	Religion	CPC	PCC / Heartbeat Int’l / Care Net / Evangelical	Saskatoon	SK	"Real Choices for Women and Families: Family Life Support Services, Inc. Real Choices Crisis Pregnancy Centre"	www.saskatoonpregnancy.com www.facebook.com/saskatoonpregancy.op tionscentre/ www.instagram.com/sk_pregnancy_option s_centre/?hl=en	"Use to offer Sexual Health Community Education, but no longer on their website."										
262.0	Second Chance Ministry	N			CPC	Catholic Church	Scarborough	ON		www.secondchanceministry.ca/											
263.0	Shuswap Pro-life Society	N			Advocacy	LifeCanada	Salmon Arm	BC		www.shuswapprolife.com www.facebook.com/ShuswapProLifeSociet y/ https://twitter.com/prolifeshuswap www.pinterest.ca/shuswapprolife/_create d/											
264.0	Signal Hill Life Education Society	Y	129669818	Poverty	Advocacy		Langley	BC	(arose from BC Pro- Life Society)	https://thesignalhill.com/about-us www.facebook.com/thesignalhill https://twitter.com/thesignalhill?lang=en www.instagram.com/thesignalhill/?hl=en	"Multiple presentations and workshops, but NOT on sexual issues. https://store.thesignalhill.com/ Targeted at teachers"										
265.0	Simcoe & District Voice for Life	Y	119286938	Poverty	Advocacy	Alliance for Life Ont.	Simcoe	ON	Voice for Life	www.simcoevoiceforlife.com/	"Says it provides educational materials for schools. www.simcoevoiceforlife.com “If there is an opportunity, we visit schools and groups, as invited on life issues”"										
266.0	Smithers Crisis Pregnancy Care Centre	N			CPC		Smithers	BC	Run by Pro-life Society of Smithers	https://smitherspregnancy.wixsite.com/car e www.facebook.com/smitherscpcc/	"“Sexual Education” is mentioned, no details."										
267.0	South Niagara Life Ministries	Y	840686000	Religion	CPC		Fort Erie	ON	South Niagara Life Centre Ministries	http://snlmcounsel.ca www.facebook.com/snlmcounsel.ca/?rc=p https://twitter.com/LifeNiagara www.instagram.com/southniagaralife/	Empowered: South Niagara Life Ministries’ Abstinence Curriculum http://snlmcounsel.ca/services.html “excellent for classroom presentations and area public school assemblies” (doesn’t specify grade or public/religious). Have to contact directly for more details.										
268.0	South Niagara Life Ministries	Y	840686000	Religion	CPC		Port Colborne	ON	South Niagara Life Centre Ministries	http://snlmcounsel.ca www.facebook.com/snlmcounsel.ca/?rc=p https://twitter.com/LifeNiagara www.instagram.com/southniagaralife/	Empowered Sexual Health/Relationships school presentations on abstinence. http://snlmcounsel.ca/services.html										
